[
  {
    "actor": "academy",
    "audit_refs": [],
    "compatibility": [
      "activity-pockets/1"
    ],
    "created_at": "2026-10-26T08:43:33.671287Z",
    "details": {
      "id": "9bbc2f43c61e483c9fcc8f05426591cf",
      "kind": "skill_validation",
      "sha256": "b7997e9e18babd7e39a5c24ec8e823ab1549a40fef5a0575afe513a4fdf02205"
    },
    "event_type": "evidence.recorded",
    "id": "05574314fd4b4f149180e0d068a8255e",
    "owner": "lam",
    "permissions": [],
    "pocket_id": "library",
    "provenance": {
      "component": "factory",
      "origin": "controlled-fixture",
      "reference": "library",
      "source_revision": "20bdad87a97e649eb751dd6c7add53d3fb9d65fe"
    },
    "schema_version": "1.0"
  },
  {
    "actor": "library",
    "audit_refs": [],
    "compatibility": [
      "activity-pockets/1"
    ],
    "created_at": "2026-10-26T08:43:33.671287Z",
    "details": {
      "id": "41ec18e9b91a4a9d8ed2ee63b85ec387",
      "kind": "library_skill",
      "sha256": "125aa5b25b73cc73307b9e0aa0adf588c1709330ec55cf977ee64673b3149a4f"
    },
    "event_type": "evidence.recorded",
    "id": "ae94a6ecb72a444182653e113141985e",
    "owner": "lam",
    "permissions": [],
    "pocket_id": "library",
    "provenance": {
      "component": "factory",
      "origin": "controlled-fixture",
      "reference": "library",
      "source_revision": "20bdad87a97e649eb751dd6c7add53d3fb9d65fe"
    },
    "schema_version": "1.0"
  },
  {
    "actor": "library",
    "audit_refs": [],
    "compatibility": [
      "activity-pockets/1"
    ],
    "created_at": "2026-10-26T08:43:33.674310Z",
    "details": {
      "id": "4f8e8a273aed407f8d60f99acf83f23e",
      "kind": "qualification",
      "sha256": "1a5b0e6d27db090358f05501d668ef07d8050b44e846eb51521048cb9dbfed3a"
    },
    "event_type": "evidence.recorded",
    "id": "c01900a8aaea4d02940e4d6aad79ee60",
    "owner": "lam",
    "permissions": [],
    "pocket_id": "195d61f13dc24a30b195225bb6fbf952",
    "provenance": {
      "component": "factory",
      "origin": "controlled-fixture",
      "reference": "195d61f13dc24a30b195225bb6fbf952",
      "source_revision": "20bdad87a97e649eb751dd6c7add53d3fb9d65fe"
    },
    "schema_version": "1.0"
  },
  {
    "actor": "pwa:11111111111111111111111111111111",
    "audit_refs": [],
    "compatibility": [
      "activity-pockets/1"
    ],
    "created_at": "2026-10-26T08:43:33.674310Z",
    "details": {
      "manifest_sha256": "e7ff08043d88398eac493963d87cb795db2bf1547d14e567921a07e58b25a50a",
      "skill_version": "1.0.0"
    },
    "event_type": "pocket.created",
    "id": "ca4b34567f6947cebf2845e71e23d50b",
    "owner": "lam",
    "permissions": [],
    "pocket_id": "195d61f13dc24a30b195225bb6fbf952",
    "provenance": {
      "component": "factory",
      "origin": "controlled-fixture",
      "reference": "195d61f13dc24a30b195225bb6fbf952",
      "source_revision": "20bdad87a97e649eb751dd6c7add53d3fb9d65fe"
    },
    "schema_version": "1.0"
  },
  {
    "actor": "orqevia",
    "audit_refs": [],
    "compatibility": [
      "activity-pockets/1"
    ],
    "created_at": "2026-10-26T08:43:33.696735Z",
    "details": {
      "factory_state": "READY",
      "objective_id": "195d61f13dc24a30b195225bb6fbf952"
    },
    "event_type": "orqevia.objective.submitted",
    "id": "4d5acdcb7fdd4228953836e673a84c7d",
    "owner": "lam",
    "permissions": [],
    "pocket_id": "195d61f13dc24a30b195225bb6fbf952",
    "provenance": {
      "component": "factory",
      "origin": "controlled-fixture",
      "reference": "195d61f13dc24a30b195225bb6fbf952",
      "source_revision": "20bdad87a97e649eb751dd6c7add53d3fb9d65fe"
    },
    "schema_version": "1.0"
  },
  {
    "actor": "library",
    "audit_refs": [],
    "compatibility": [
      "activity-pockets/1"
    ],
    "created_at": "2026-10-26T08:43:33.761322Z",
    "details": {
      "id": "61f5da4b06d746d6a2665daa9e9bcc49",
      "kind": "qualification",
      "sha256": "da78b713f87f95105e6c7b29d2082cea1a52331ab25d42b1c6f377adab158feb"
    },
    "event_type": "evidence.recorded",
    "id": "768437c0d38141dc99204fa5a31adcf5",
    "owner": "lam",
    "permissions": [],
    "pocket_id": "195d61f13dc24a30b195225bb6fbf952",
    "provenance": {
      "component": "factory",
      "origin": "controlled-fixture",
      "reference": "195d61f13dc24a30b195225bb6fbf952",
      "source_revision": "20bdad87a97e649eb751dd6c7add53d3fb9d65fe"
    },
    "schema_version": "1.0"
  },
  {
    "actor": "factory-worker",
    "audit_refs": [],
    "compatibility": [
      "activity-pockets/1"
    ],
    "created_at": "2026-10-26T08:43:33.761322Z",
    "details": {
      "cursor": 0,
      "run_id": "936c384e64b74a0caeda1860e5ced441",
      "version": "1.0.0"
    },
    "event_type": "execution.started",
    "id": "ffc9eb9bf9c3460a8c9e4f6416381d12",
    "owner": "lam",
    "permissions": [],
    "pocket_id": "195d61f13dc24a30b195225bb6fbf952",
    "provenance": {
      "component": "factory",
      "origin": "controlled-fixture",
      "reference": "195d61f13dc24a30b195225bb6fbf952",
      "source_revision": "20bdad87a97e649eb751dd6c7add53d3fb9d65fe"
    },
    "schema_version": "1.0"
  },
  {
    "actor": "factory",
    "audit_refs": [],
    "compatibility": [
      "activity-pockets/1"
    ],
    "created_at": "2026-10-26T08:43:33.840847Z",
    "details": {
      "id": "8e07e907c6104f0bb425286eeb67986c",
      "kind": "output",
      "sha256": "81454bc5edae5c8e90104f6603d660623b23ed6c821e891a43c51471b2fc3370"
    },
    "event_type": "evidence.recorded",
    "id": "c9e2c4099bdd464fab2b363186fce227",
    "owner": "lam",
    "permissions": [],
    "pocket_id": "195d61f13dc24a30b195225bb6fbf952",
    "provenance": {
      "component": "factory",
      "origin": "controlled-fixture",
      "reference": "195d61f13dc24a30b195225bb6fbf952",
      "source_revision": "20bdad87a97e649eb751dd6c7add53d3fb9d65fe"
    },
    "schema_version": "1.0"
  },
  {
    "actor": "factory-worker",
    "audit_refs": [],
    "compatibility": [
      "activity-pockets/1"
    ],
    "created_at": "2026-10-26T08:43:33.841399Z",
    "details": {
      "output_id": "8e07e907c6104f0bb425286eeb67986c",
      "records": 2,
      "run_id": "936c384e64b74a0caeda1860e5ced441",
      "status": "READY"
    },
    "event_type": "execution.finished",
    "id": "ab54c9fd6b9841da9939dda043631b52",
    "owner": "lam",
    "permissions": [],
    "pocket_id": "195d61f13dc24a30b195225bb6fbf952",
    "provenance": {
      "component": "factory",
      "origin": "controlled-fixture",
      "reference": "195d61f13dc24a30b195225bb6fbf952",
      "source_revision": "20bdad87a97e649eb751dd6c7add53d3fb9d65fe"
    },
    "schema_version": "1.0"
  },
  {
    "actor": "library",
    "audit_refs": [],
    "compatibility": [
      "activity-pockets/1"
    ],
    "created_at": "2026-10-26T08:43:35.930427Z",
    "details": {
      "id": "7226ccffa9a344f0914036327faa9b2a",
      "kind": "qualification",
      "sha256": "2fa08c8ef34db7ac56bb33dfa7102dcff4693b698aefd5b6b311eefdb9516091"
    },
    "event_type": "evidence.recorded",
    "id": "8dea2c3bb8cb4723b47c84ba21474ffa",
    "owner": "lam",
    "permissions": [],
    "pocket_id": "195d61f13dc24a30b195225bb6fbf952",
    "provenance": {
      "component": "factory",
      "origin": "controlled-fixture",
      "reference": "195d61f13dc24a30b195225bb6fbf952",
      "source_revision": "20bdad87a97e649eb751dd6c7add53d3fb9d65fe"
    },
    "schema_version": "1.0"
  },
  {
    "actor": "factory-worker",
    "audit_refs": [],
    "compatibility": [
      "activity-pockets/1"
    ],
    "created_at": "2026-10-26T08:43:35.959721Z",
    "details": {
      "cursor": 1,
      "run_id": "0baf40f087bf497ab84df7f7af74b059",
      "version": "1.0.0"
    },
    "event_type": "execution.started",
    "id": "dec3b28604a44150898a8d7303d767ec",
    "owner": "lam",
    "permissions": [],
    "pocket_id": "195d61f13dc24a30b195225bb6fbf952",
    "provenance": {
      "component": "factory",
      "origin": "controlled-fixture",
      "reference": "195d61f13dc24a30b195225bb6fbf952",
      "source_revision": "20bdad87a97e649eb751dd6c7add53d3fb9d65fe"
    },
    "schema_version": "1.0"
  },
  {
    "actor": "a07",
    "audit_refs": [],
    "compatibility": [
      "activity-pockets/1"
    ],
    "created_at": "2026-10-26T08:43:36.044615Z",
    "details": {
      "bytes": 350,
      "code": "LAYOUT_FIELDS_MISSING",
      "run_id": "0baf40f087bf497ab84df7f7af74b059",
      "seconds": 0.06199999999989814
    },
    "event_type": "execution.failed",
    "id": "45e7ee75576f4760bad041cb60910fd8",
    "owner": "lam",
    "permissions": [],
    "pocket_id": "195d61f13dc24a30b195225bb6fbf952",
    "provenance": {
      "component": "factory",
      "origin": "controlled-fixture",
      "reference": "195d61f13dc24a30b195225bb6fbf952",
      "source_revision": "20bdad87a97e649eb751dd6c7add53d3fb9d65fe"
    },
    "schema_version": "1.0"
  },
  {
    "actor": "academy",
    "audit_refs": [],
    "compatibility": [
      "activity-pockets/1"
    ],
    "created_at": "2026-10-26T08:43:36.056030Z",
    "details": {
      "id": "f3b40862c100456aa05715a908bb5595",
      "kind": "academy_training",
      "sha256": "958afcb7eea0672f2d4654cb42d43601affe9830a88342bd39d4d5f7f64b4868"
    },
    "event_type": "evidence.recorded",
    "id": "f34e1ec8c2f9460fbb4f798834ffee31",
    "owner": "lam",
    "permissions": [],
    "pocket_id": "195d61f13dc24a30b195225bb6fbf952",
    "provenance": {
      "component": "factory",
      "origin": "controlled-fixture",
      "reference": "195d61f13dc24a30b195225bb6fbf952",
      "source_revision": "20bdad87a97e649eb751dd6c7add53d3fb9d65fe"
    },
    "schema_version": "1.0"
  },
  {
    "actor": "academy",
    "audit_refs": [],
    "compatibility": [
      "activity-pockets/1"
    ],
    "created_at": "2026-10-26T08:43:36.060917Z",
    "details": {
      "id": "192bbee5bacb4754818afff59a92dad5",